[
  {
    "airline_id": "2B",
    "name": "OJSC AK BARS AERO",
    "code_type": "iata",
    "iata_code": "2B",
    "icao_code": "",
    "country": "",
    "region": "",
    "status": "unknown",
    "active": "",
    "website": "",
    "wikidata_id": "",
    "notes": "Imported from original repository. Country, status, and source enrichment pending."
  },
  {
    "airline_id": "2I",
    "name": "Star Peru",
    "code_type": "iata",
    "iata_code": "2I",
    "icao_code": "",
    "country": "",
    "region": "",
    "status": "unknown",
    "active": "",
    "website": "",
    "wikidata_id": "",
    "notes": "Imported from original repository. Country, status, and source enrichment pending."
  },
  {
    "airline_id": "2J",
    "name": "Air Burkina",
    "code_type": "iata",
    "iata_code": "2J",
    "icao_code": "",
    "country": "",
    "region": "",
    "status": "unknown",
    "active": "",
    "website": "",
    "wikidata_id": "",
    "notes": "Imported from original repository. Country, status, and source enrichment pending."
  },
  {
    "airline_id": "2K",
    "name": "Aerogal",
    "code_type": "iata",
    "iata_code": "2K",
    "icao_code": "",
    "country": "",
    "region": "",
    "status": "unknown",
    "active": "",
    "website": "",
    "wikidata_id": "",
    "notes": "Imported from original repository. Country, status, and source enrichment pending."
  },
  {
    "airline_id": "2L",
    "name": "Helvetic Airways",
    "code_type": "iata",
    "iata_code": "2L",
    "icao_code": "",
    "country": "",
    "region": "",
    "status": "unknown",
    "active": "",
    "website": "",
    "wikidata_id": "",
    "notes": "Imported from original repository. Country, status, and source enrichment pending."
  },
  {
    "airline_id": "2N",
    "name": "Nextjet",
    "code_type": "iata",
    "iata_code": "2N",
    "icao_code": "",
    "country": "",
    "region": "",
    "status": "unknown",
    "active": "",
    "website": "",
    "wikidata_id": "",
    "notes": "Imported from original repository. Country, status, and source enrichment pending."
  },
  {
    "airline_id": "2O",
    "name": "Island Air Service",
    "code_type": "iata",
    "iata_code": "2O",
    "icao_code": "",
    "country": "",
    "region": "",
    "status": "unknown",
    "active": "",
    "website": "",
    "wikidata_id": "",
    "notes": "Imported from original repository. Country, status, and source enrichment pending."
  },
  {
    "airline_id": "2P",
    "name": "PAL Express",
    "code_type": "iata",
    "iata_code": "2P",
    "icao_code": "",
    "country": "",
    "region": "",
    "status": "unknown",
    "active": "",
    "website": "",
    "wikidata_id": "",
    "notes": "Imported from original repository. Country, status, and source enrichment pending."
  },
  {
    "airline_id": "3B",
    "name": "Job Air - Central Connect Airlines",
    "code_type": "iata",
    "iata_code": "3B",
    "icao_code": "",
    "country": "",
    "region": "",
    "status": "unknown",
    "active": "",
    "website": "",
    "wikidata_id": "",
    "notes": "Imported from original repository. Country, status, and source enrichment pending."
  },
  {
    "airline_id": "3F",
    "name": "Pacific Airways Inc",
    "code_type": "iata",
    "iata_code": "3F",
    "icao_code": "",
    "country": "",
    "region": "",
    "status": "unknown",
    "active": "",
    "website": "",
    "wikidata_id": "",
    "notes": "Imported from original repository. Country, status, and source enrichment pending."
  },
  {
    "airline_id": "3G",
    "name": "Gambia Bird Airlines Ltd.",
    "code_type": "iata",
    "iata_code": "3G",
    "icao_code": "",
    "country": "",
    "region": "",
    "status": "unknown",
    "active": "",
    "website": "",
    "wikidata_id": "",
    "notes": "Imported from original repository. Country, status, and source enrichment pending."
  },
  {
    "airline_id": "3H",
    "name": "Air Inuit",
    "code_type": "iata",
    "iata_code": "3H",
    "icao_code": "",
    "country": "",
    "region": "",
    "status": "unknown",
    "active": "",
    "website": "",
    "wikidata_id": "",
    "notes": "Imported from original repository. Country, status, and source enrichment pending."
  },
  {
    "airline_id": "3J",
    "name": "Jubba Airways Ltd",
    "code_type": "iata",
    "iata_code": "3J",
    "icao_code": "",
    "country": "",
    "region": "",
    "status": "unknown",
    "active": "",
    "website": "",
    "wikidata_id": "",
    "notes": "Imported from original repository. Country, status, and source enrichment pending."
  },
  {
    "airline_id": "3K",
    "name": "Jetstar Asia",
    "code_type": "iata",
    "iata_code": "3K",
    "icao_code": "",
    "country": "",
    "region": "",
    "status": "unknown",
    "active": "",
    "website": "",
    "wikidata_id": "",
    "notes": "Imported from original repository. Country, status, and source enrichment pending."
  },
  {
    "airline_id": "3L",
    "name": "Intersky",
    "code_type": "iata",
    "iata_code": "3L",
    "icao_code": "",
    "country": "",
    "region": "",
    "status": "unknown",
    "active": "",
    "website": "",
    "wikidata_id": "",
    "notes": "Imported from original repository. Country, status, and source enrichment pending."
  },
  {
    "airline_id": "3M",
    "name": "Silver Airways Corp",
    "code_type": "iata",
    "iata_code": "3M",
    "icao_code": "",
    "country": "",
    "region": "",
    "status": "unknown",
    "active": "",
    "website": "",
    "wikidata_id": "",
    "notes": "Imported from original repository. Country, status, and source enrichment pending."
  },
  {
    "airline_id": "3O",
    "name": "Air Arabia Maroc",
    "code_type": "iata",
    "iata_code": "3O",
    "icao_code": "",
    "country": "",
    "region": "",
    "status": "unknown",
    "active": "",
    "website": "",
    "wikidata_id": "",
    "notes": "Imported from original repository. Country, status, and source enrichment pending."
  },
  {
    "airline_id": "3P",
    "name": "Tiara Air Aruba",
    "code_type": "iata",
    "iata_code": "3P",
    "icao_code": "",
    "country": "",
    "region": "",
    "status": "unknown",
    "active": "",
    "website": "",
    "wikidata_id": "",
    "notes": "Imported from original repository. Country, status, and source enrichment pending."
  },
  {
    "airline_id": "3R",
    "name": "Gromov Air",
    "code_type": "iata",
    "iata_code": "3R",
    "icao_code": "",
    "country": "",
    "region": "",
    "status": "unknown",
    "active": "",
    "website": "",
    "wikidata_id": "",
    "notes": "Imported from original repository. Country, status, and source enrichment pending."
  },
  {
    "airline_id": "3S",
    "name": "Air Antilles",
    "code_type": "iata",
    "iata_code": "3S",
    "icao_code": "",
    "country": "",
    "region": "",
    "status": "unknown",
    "active": "",
    "website": "",
    "wikidata_id": "",
    "notes": "Imported from original repository. Country, status, and source enrichment pending."
  },
  {
    "airline_id": "3U",
    "name": "Sichuan Airlines",
    "code_type": "iata",
    "iata_code": "3U",
    "icao_code": "",
    "country": "",
    "region": "",
    "status": "unknown",
    "active": "",
    "website": "",
    "wikidata_id": "",
    "notes": "Imported from original repository. Country, status, and source enrichment pending."
  },
  {
    "airline_id": "4D",
    "name": "Air Sinai",
    "code_type": "iata",
    "iata_code": "4D",
    "icao_code": "",
    "country": "",
    "region": "",
    "status": "unknown",
    "active": "",
    "website": "",
    "wikidata_id": "",
    "notes": "Imported from original repository. Country, status, and source enrichment pending."
  },
  {
    "airline_id": "4E",
    "name": "Tanana Air Service",
    "code_type": "iata",
    "iata_code": "4E",
    "icao_code": "",
    "country": "",
    "region": "",
    "status": "unknown",
    "active": "",
    "website": "",
    "wikidata_id": "",
    "notes": "Imported from original repository. Country, status, and source enrichment pending."
  },
  {
    "airline_id": "4G",
    "name": "Gazpromavia",
    "code_type": "iata",
    "iata_code": "4G",
    "icao_code": "",
    "country": "",
    "region": "",
    "status": "unknown",
    "active": "",
    "website": "",
    "wikidata_id": "",
    "notes": "Imported from original repository. Country, status, and source enrichment pending."
  },
  {
    "airline_id": "4H",
    "name": "United Airways Bangladesh",
    "code_type": "iata",
    "iata_code": "4H",
    "icao_code": "",
    "country": "",
    "region": "",
    "status": "unknown",
    "active": "",
    "website": "",
    "wikidata_id": "",
    "notes": "Imported from original repository. Country, status, and source enrichment pending."
  },
  {
    "airline_id": "4K",
    "name": "Kenn Borek Air",
    "code_type": "iata",
    "iata_code": "4K",
    "icao_code": "",
    "country": "",
    "region": "",
    "status": "unknown",
    "active": "",
    "website": "",
    "wikidata_id": "",
    "notes": "Imported from original repository. Country, status, and source enrichment pending."
  },
  {
    "airline_id": "4M",
    "name": "LanArgentina",
    "code_type": "iata",
    "iata_code": "4M",
    "icao_code": "",
    "country": "",
    "region": "",
    "status": "unknown",
    "active": "",
    "website": "",
    "wikidata_id": "",
    "notes": "Imported from original repository. Country, status, and source enrichment pending."
  },
  {
    "airline_id": "4N",
    "name": "Air North",
    "code_type": "iata",
    "iata_code": "4N",
    "icao_code": "",
    "country": "",
    "region": "",
    "status": "unknown",
    "active": "",
    "website": "",
    "wikidata_id": "",
    "notes": "Imported from original repository. Country, status, and source enrichment pending."
  },
  {
    "airline_id": "4O",
    "name": "Interjet",
    "code_type": "iata",
    "iata_code": "4O",
    "icao_code": "",